productID,description,category,vendor,brand,product_information,additional_information,shipping_returns
195,Oraimo 20000mAh Power Charging Bank Fast Charging OPB-P208DN,65,3,144,Oraimo Power bank,,1
196,Oraimo 10000mAh Power-Bank 2.1A For 2 Device Same Time OPB-P110DN,65,3,144,Oraimo Power bank,,1
197,"Oraimo 20,000MAH Type C & USB Port Powerbank",65,3,144,Oraimo Power bank,,1
198,Oraimo 10000mah Power-Bank 2.4A Fast Charging OPB-P118D,65,3,144,Oraimo Power bank,,1
199,Oraimo Dual USB Output 204D Power-Bank 20000mAh Fast Charging,65,3,144,Oraimo Power bank,,1
200,Oraimo 30000mah Massive Ultra Two-way Fast Powerbank,65,3,144,Oraimo Power bank,,1
201,Oraimo 40000mah Laptop Power Bank 22.5W Digital Display,65,3,144,Oraimo Power bank,,1
202,Oraimo 10000mAh 12W Fast Charge Power-Bank,65,3,144,Oraimo Power bank,,1
203,Oraimo 30000Mah High Speed Fast Charging Power Bank,65,3,144,Oraimo Power bank,,1
204,Oraimo Traveler Link 27 27000mAh 3 Built-in Charging Cables AniFast 12W Fast Charge,65,3,144,Oraimo Power bank,,1
205,Oraimo 22.5W LED Light Super Fast 50000mA Power Bank + Free Charger,65,3,144,Oraimo Power bank,,1
206,Oraimo 40000mAh Strong Massive Power Bank With LED Light,65,3,144,Oraimo Power bank,,1
207,Oraimo PowerBox-600 60000m-A-h 22.5W Super Power Bank,65,3,144,Oraimo Power bank,,1
208,Oraimo MagPower 5000mAh Magnetic Wireless Power Bank,65,3,144,Oraimo Power bank,,1
209,Oraimo 22.5W Super Fast 5 Output Port LED Light 60000mA Power Bank + Free Charger,65,3,144,Oraimo Power bank,,1
210,Realme earbuds ORAIMO FREEPODS Bluetooth Earbuds Wireless Stereo Earphones Earpóds,67,3,144,"Mini Invisible wireless earphone design;

Super Mini size and hidden in the ear, do not wear the bale;

Unique headset design, stable in the ear, good for driving, sports, business, or leisure;

Signal with  Wireless range (no obstacles);

Deep DPS-noise reduction microphone ensures clear call quality;

Voice prompt for pairing, calling, turn on/off;

One button function for on/off, song switch, language change, receive calls;

Specification:

Material: ABS Plastic

Package Includes:

1 Set Earphone

Note:

Please visit our Instagram page @quickstore.ng for more information on our products

Your satisfaction is our utmost concern.

Thank you",,1
211,Oraimo Rock Long Playtime 2-mic ENC TWS True Wireless Earbuds,67,3,144,"Long Lasting 24H Playtime-Charge on the Go

Playtime lasts for over 8 hours from single charge and total 24 hours with charging case. If you are low on power, 10 minutes of charge time gives you up to 60 minutes of playback.

*Results are based on 50% volume. Battery life may vary depending on the volume, the source of playback, the temperature, environmental interference, and the users habits.



Amazing Bass Quality-Bass that Touches You

Provides seriously powerful and punchy bass. Efficiently restores the authentic sound quality.



IPX5 Waterproof-Water Resistant for Daily Use

IPX5 protects your earbuds from sweat, water, rain, etc. A perfect choice for running, jogging, cycling, working out in the gym.



2-mic ENC Technology-Environmental Noise Canceling for Clear Call

ENC technology effectively suppresses environmental noise, making the person you are calling hear your voice more clearly.



Tiny Size and Fit Design-Comfortable and Secure

Perfectly fits the curve of inner contour of ear. Whether you re running or jumping, the earbuds will stay in ear securely.",,1
212,Oraimo Rhyme ANC Active Noise Cancellation ENC Noise Cancellation True Wireless Earbuds,67,3,144,Oriamo Wireless Airbuds,,1
213,Oraimo BURNA BOY Space Pod Noise Cancellation Earbud,67,3,144,Oriamo Wireless Airbuds,,1
214,Oraimo FreePods Pro ANC Active Noise Cancellation Wireless Earbuds,67,3,144,Oriamo Wireless Airbuds,,1
215,Oraimo FreePods 4 Active Noise Cancellation Earbuds,67,3,144,Oriamo Wireless Airbuds,,1
216,Oraimo FreePods Lite 40-hour Playtime ENC True Wireless Earbuds,67,3,144,Oriamo Wireless Airbuds,,1
217,Oraimo FreePods 3C ENC Calling Noise Cancellation True Wireless Earbuds,67,3,144,Oriamo Wireless Airbuds,,1
218,Oraimo Riff 2 ENC True Wireless Earbuds With APP Control,67,3,144,Oriamo Wireless Airbuds,,1
219,Oraimo Riff True Wireless Earbuds - Red,67,3,144,Oriamo Wireless Airbuds,,1
220,Oraimo Havy Base with long lasting battery SHARK 4 NECKLACE EARBUD,67,3,144,Oriamo Wireless Airbuds,,1
221,Oraimo Air Buds-3S Super Bass True Wireless Stereo Smart Earbuds,67,3,144,Oriamo Wireless Airbuds,,1
222,Oraimo Air 12 Pro Fingerprint Earbuds + Inbuilt Power Bank,67,3,144,"<ul class=""highlights text-left"" style=""box-sizing: border-box; padding: 0px 0px 0px 15px; margin: 0px 0px 15px;""><li style=""box-sizing: border-box; padding: 0px; margin: 0px; line-height: 18px;"">Stereo Best Quality</li><li style=""box-sizing: border-box; padding: 0px; margin: 0px; line-height: 18px;"">LED Power Display</li><li style=""box-sizing: border-box; padding: 0px; margin: 0px; line-height: 18px;"">Noise Reduction</li><li style=""box-sizing: border-box; padding: 0px; margin: 0px; line-height: 18px;"">Low Power Consumption</li><li style=""box-sizing: border-box; padding: 0px; margin: 0px;""><p style=""box-sizing: inherit; padding: 0px; margin: 0px; color: rgb(49, 49, 51); font-family: -apple-system, BlinkMacSystemFont, Roboto, "" helvetica="""" neue"",="""" arial,="""" sans-serif;="""" font-size:="""" 12px;""="""">High Defination Sound Active Noise Cancellation Technology Delicate &amp; Stylish Design Light Weight &amp; Extremely Convenient to use<br style=""box-sizing: inherit;"">Soft head beam lining &amp; ear cushions<br style=""box-sizing: inherit;"">More comfortable to wear<br style=""box-sizing: inherit;"">Ergonomic Design<br style=""box-sizing: inherit;"">Suitable for different head types and sizes<br style=""box-sizing: inherit;"">Play Various Games Immersively</p><p style=""box-sizing: inherit; padding: 0px; margin: 0px; color: rgb(49, 49, 51); font-family: -apple-system, BlinkMacSystemFont, Roboto, "" helvetica="""" neue"",="""" arial,="""" sans-serif;="""" font-size:="""" 12px;""="""">Using the brand new Bluetooth 5.1 technology<br style=""box-sizing: inherit;"">More Powerful high-speed transmission efficiency</p></li></ul>",,1
223,Oraimo Wireless FreePods Lite 40-hour Playtime ENC True Wireless Earbuds - sky blue,67,3,144,Air buds,,1
224,Oraimo Air-Buds 4 ENC True Wireless Earbuds,67,3,144,"Smart LED Power Display
See Remaining Power at a Glance

You can effortlessly monitor the remaining power of each earbud and the charging case through the convenient power LED display.

*The LED display shows charging case and earbud battery levels, adjusting by 1% and 10% respectively.",,1
225,Jbl Premium Quality- Jbl MG-S22 Wireless Bluetooth Earbud,68,3,145,"<ul style=""box-sizing: border-box; padding: 0px 0px 0px 16px; margin: 0px; font-family: Roboto, -apple-system, BlinkMacSystemFont, "" segoe="""" ui"",="""" ""helvetica="""" neue"",="""" arial,="""" sans-serif;="""" font-size:="""" 16px;="""" color:="""" rgb(40,="""" 40,="""" 40);""=""""><li style=""box-sizing: border-box; padding: 0px; margin: 0px;"">-IOS: Popup window prompts that the headset is ready to connect, just click ""Connect""</li><li style=""box-sizing: border-box; padding: 0px; margin: 0px;"">- For Android OS: Enable Bluetooth pairing mode on your mobile device.</li><li style=""box-sizing: border-box; padding: 0px; margin: 0px;"">- touch sensor</li><li style=""box-sizing: border-box; padding: 0px; margin: 0px;"">- Bluetooth 5.0</li><li style=""box-sizing: border-box; padding: 0px; margin: 0px;"">- long battery life</li><li style=""box-sizing: border-box; padding: 0px; margin: 0px;"">- Wear without feeling</li><li style=""box-sizing: border-box; padding: 0px; margin: 0px;"">- Dual noise reduction</li><li style=""box-sizing: border-box; padding: 0px; margin: 0px;"">- 13mm unit (titanium-plated diaphragm for shocking sound quality)</li><li style=""box-sizing: border-box; padding: 0px; margin: 0px;"">- IPX5 dust and waterproof</li><li style=""box-sizing: border-box; padding: 0px; margin: 0px;"">- Smart Touch</li><li style=""box-sizing: border-box; padding: 0px; margin: 0px;"">- Voice assistant support Hey Siri</li><li style=""box-sizing: border-box; padding: 0px; margin: 0px;"">- Battery level indicator</li><li style=""box-sizing: border-box; padding: 0px; margin: 0px;"">- Sound quality (for music and video)</li><li style=""box-sizing: border-box; padding: 0px; margin: 0px;"">- change name</li><li style=""box-sizing: border-box; padding: 0px; margin: 0px;"">- Track and find my Phone</li><li style=""box-sizing: border-box; padding: 0px; margin: 0px;"">- Active Noise Cancellation and Transparency Mode page (for settings page only - no actual effect)</li><li style=""box-sizing: border-box; padding: 0px; margin: 0px;""><br style=""box-sizing: border-box;""></li><li style=""box-sizing: border-box; padding: 0px; margin: 0px;"">Dual beamforming microphones</li><li style=""box-sizing: border-box; padding: 0px; margin: 0px;"">Built-in microphone</li><li style=""box-sizing: border-box; padding: 0px; margin: 0px;""><br style=""box-sizing: border-box;""></li><li style=""box-sizing: border-box; padding: 0px; margin: 0px;"">Play, pause or answer calls with just one click</li><li style=""box-sizing: border-box; padding: 0px; margin: 0px;"">Double click to fast forward</li><li style=""box-sizing: border-box; padding: 0px; margin: 0px;"">Triple tap to jump back</li></ul>",,1
226,Realme earbuds Wireless Earbuds Bluetooth 5.0 Earphones 6D Bass Earphones,69,,146,"<ul><li>As the noise pollution in the city becomes more and more serious, using ordinary earphone earplugs outdoors can only increase the volume to drown out the noise, thus not only can t enjoy the beautiful music, but also has a great impact on their hearing.The emergence of noise-cancelling earphones has solved this problem well.</li><li>The development of headphone display is moving towards wireless and noise reduction.Wireless headphones are more free to use. With the development of science and technology, wireless transmission technology is gradually mature, ensuring the sound quality of wireless headphones.Another reason is the popularity of music on mobile phones and the birth of bluetooth wireless transmission technology.</li><li>The active noise cancelling headset has a noise cancelling device. The noise cancelling device USES the microphone to collect the sound from the outside world and emit the opposite sound wave to cancel the noise.Today, people are more and more concerned about their health. Noise-canceling earphones can better enjoy music outdoors and ensure the health of ears, which is the development direction of earphones in the future.</li><li>With the development of earphones, the most important sound unit is the moving coil sound unit.After so many years of development, the moving-coil headphone technology has been very mature, but also encountered a bottleneck in the improvement of sound.In addition to static headphones, there are many derivative technologies for moving coil articulation units, among which the most widely used is the moving iron articulation unit.</li><li>The ear muffs of the closed earphones adopt a completely closed structure, which can prevent the external sound from entering, so the pressure on the ears is greater, and the sound positioning is accurate and clear. This structure is often used in the field of professional monitoring.There are also some closed earphones with the sound field of open earphones, which can insulate the noise while still maintaining high quality sound.</li><li>There is no strict regulation on the semi-open earphone, the sound can only go in or out, according to the use of the need to make design adjustments.</li><li><br></li><li>Style:In-Ear</li><li>Wireless Type:bluetooth</li><li>Connectors:USB</li><li>Communication:Wireless</li><li>Is wireless:Yes</li><li>Line Length:None</li><li>Support APP</li><li>Function:for Video Game</li><li>Function:For Mobile Phone</li><li>Function:For iPod</li><li>Function:HiFi Headphone</li><li>Function:Sport</li><li>Plug Type:Wireless</li><li>With Microphone:Yes</li><li>Compatibility:For IOS,For Android,windows</li><li>Function 1:summon Siri</li><li>Function 2:volume decrease</li><li>Function 3:switch previous song</li><li>Function 4:touch operation</li><li>Function 5:intelligent noise reduction</li><li>Function 6:binaural HD call</li></ul>",,1
227,Realme earbuds NEWAGE EarPhones Bluetooth For Android And Apple Earbuds Phone Earpiece Hear 5.0 Wireless Earpóds Headphones Aírpods,69,,146,Air buds,,1
228,Realme earbuds Bluetooth Earbuds With Powerbank Wireless Earbud Bluetooth 5 0 Earphone Microphone,69,,,Air buds,,1
229,Realme earbuds Bluetooth Earpiece Wireless Earbuds 8D Earpóds Stereo Bass Earphones Earpiece,69,,,"Mini in-ear wireless invisible design;

Super Mini Size and hidden in the ear, no wearing burden;

Ergonomic earphone design, stable in the ear, good for driving, sports, business, or leisure;

Bluetooth Connection

Deep DPS noise-reduction microphone ensures clear call quality;

Voice prompt for pairing, calling, turn on/off;

One function button for on/off, song switch, language change, receive call.",,1
230,Realme earbuds Bluètooth Wìreless Earphones Headphones Earpiece Noise Cancellation Stereo Earpóds Bass Earpiece Wireless Earbuds Headset,69,,,Air buds,,1
231,Realme earbuds Wireless One Ear Earbuds Bluetooth Earpiece Single Earpóds Headphones Earphones,69,,,Air buds,,1
232,Realme earbuds Itel Wireless Earbuds Bluetooth Earpiece,69,,,Air buds,,1
233,Realme earbuds Sleek Wireless Earbuds Bluetooth Headphones Earpod Earpiece Fingerprint Touch Control Bass Iphone Headset,69,,,"<ul><li>Built in controls for play/pause/next/prev and answering calls</li>
<li>Built in microphone for hand free calls</li>
<li>Touch control key function- previous track / next track- accept / reject calls</li> </ul>
Siri function for iPhone, 
voice assistant for Android phone",,1
234,Realme earbuds NEWAGE Wireless Earbuds Bluetooth Headphones 5.0 Earpods 6D Bass Airpods Earphones,69,,,Air buds,,1
235,Realme earbuds NEWAGE Bluetooth Wireless Earpóds Touch Control 6D Ear Pod Iphone Stereo Bass Earbuds Headphones Earphones With Display Headset,69,,,"Features:

Mini in-ear wireless invisible design;

Super Mini Size and hidden in the ear, no wearing burden;

Ergonomic earphone design, stable in the ear, good for driving, sports, business, or leisure;

Bluetooth Connection

Deep DPS noise-reduction microphone ensures clear call quality;

Voice prompt for pairing, calling, turn on/off;

One function button for on/off, song switch, language change, receive call.

PACKAGE

2x Mini Earphones (Left and Right Ear-buds)                            
1x Charging box                            
1x User Manual                            
1*Micro-USB Cable",,1
235,Realme earbuds Wireless Bluetooth Gaming Headset Earbuds Headphone,69,,,"<ul style=""box-sizing: border-box; padding: 0px 0px 0px 16px; margin: 0px; color: rgb(40, 40, 40); font-family: Roboto, -apple-system, BlinkMacSystemFont, "" segoe="""" ui"",="""" ""helvetica="""" neue"",="""" arial,="""" sans-serif;="""" font-size:="""" 14px;""=""""><li style=""box-sizing: border-box; padding: 0px; margin: 0px;"">Style:In-ear</li><li style=""box-sizing: border-box; padding: 0px; margin: 0px;"">Certification:Ce</li><li style=""box-sizing: border-box; padding: 0px; margin: 0px;"">Vocalism Principle:Balanced Armature</li><li style=""box-sizing: border-box; padding: 0px; margin: 0px;"">Origin:Cn(origin)</li><li style=""box-sizing: border-box; padding: 0px; margin: 0px;"">Control Button:Yes</li><li style=""box-sizing: border-box; padding: 0px; margin: 0px;"">Active Noise-cancellation:Yes</li><li style=""box-sizing: border-box; padding: 0px; margin: 0px;"">Communication:Wireless</li><li style=""box-sizing: border-box; padding: 0px; margin: 0px;"">Volume Control:Yes</li><li style=""box-sizing: border-box; padding: 0px; margin: 0px;"">Wireless Type:Bluetooth</li><li style=""box-sizing: border-box; padding: 0px; margin: 0px;"">Is Wireless:Yes</li><li style=""box-sizing: border-box; padding: 0px; margin: 0px;"">Function:For Video Game</li><li style=""box-sizing: border-box; padding: 0px; margin: 0px;"">Function:Hifi Headphone</li><li style=""box-sizing: border-box; padding: 0px; margin: 0px;"">Support Memory Card:No</li><li style=""box-sizing: border-box; padding: 0px; margin: 0px;"">Charging Method:Cable</li><li style=""box-sizing: border-box; padding: 0px; margin: 0px;"">Bluetooth Version::V5.2</li><li style=""box-sizing: border-box; padding: 0px; margin: 0px;"">Support:Dropship/wholesale</li><li style=""box-sizing: border-box; padding: 0px; margin: 0px;"">Communication Distance:10m</li><li style=""box-sizing: border-box; padding: 0px; margin: 0px;"">Single Ear Capacity:50mah</li><li style=""box-sizing: border-box; padding: 0px; margin: 0px;"">Music Time:About 35h (with Charging Cabin)</li><li style=""box-sizing: border-box; padding: 0px; margin: 0px;"">Standby Time:About 55h (used With Charging Cabin)</li><li style=""box-sizing: border-box; padding: 0px; margin: 0px;"">Earphone Size:22 * 15mm (manual Measurement Error, For Reference Only)</li></ul>",,1
